{
  "$schema": "https://json-schema.org/draft/2020-12/schema",
  "$id": "https://bam.dev/schema/web-project.schema.json",
  "title": "BAM.dev Web Project collection",
  "type": "object",
  "required": ["schemaVersion", "contractVersion", "title", "projects"],
  "properties": {
    "schemaVersion": { "const": 1 },
    "contractVersion": { "const": 1 },
    "title": { "type": "string", "minLength": 1, "maxLength": 100 },
    "projects": {
      "type": "array",
      "minItems": 1,
      "maxItems": 20,
      "items": { "$ref": "#/$defs/project" }
    }
  },
  "additionalProperties": false,
  "$defs": {
    "stableId": {
      "type": "string",
      "pattern": "^[a-z0-9]+(?:-[a-z0-9]+)*$"
    },
    "conceptId": {
      "type": "string",
      "pattern": "^[a-z][a-z0-9-]*(?:\\.[a-z][a-z0-9-]*)+$"
    },
    "safePath": {
      "type": "string",
      "minLength": 1,
      "maxLength": 160,
      "pattern": "^[a-z0-9][a-z0-9._-]*(?:/[a-z0-9][a-z0-9._-]*)*$"
    },
    "project": {
      "type": "object",
      "required": [
        "id",
        "slug",
        "revision",
        "order",
        "title",
        "summary",
        "difficulty",
        "estimatedMinutes",
        "instructions",
        "requirements",
        "conceptRefs",
        "files",
        "automaticCriteria",
        "manualCriteria"
      ],
      "properties": {
        "id": {
          "type": "string",
          "pattern": "^web-project-[a-z0-9]+(?:-[a-z0-9]+)*$"
        },
        "slug": { "$ref": "#/$defs/stableId" },
        "revision": { "type": "integer", "minimum": 1 },
        "order": { "type": "integer", "minimum": 1 },
        "title": { "type": "string", "minLength": 1, "maxLength": 100 },
        "summary": { "type": "string", "minLength": 1, "maxLength": 300 },
        "difficulty": {
          "enum": ["beginner", "intermediate", "advanced"]
        },
        "estimatedMinutes": { "type": "integer", "minimum": 10, "maximum": 480 },
        "instructions": { "type": "string", "minLength": 1, "maxLength": 3000 },
        "requirements": {
          "type": "array",
          "minItems": 1,
          "maxItems": 20,
          "uniqueItems": true,
          "items": { "type": "string", "minLength": 1, "maxLength": 300 }
        },
        "conceptRefs": {
          "type": "array",
          "minItems": 1,
          "maxItems": 8,
          "items": { "$ref": "#/$defs/conceptRef" }
        },
        "files": {
          "type": "array",
          "minItems": 2,
          "maxItems": 2,
          "items": { "$ref": "#/$defs/projectFile" }
        },
        "automaticCriteria": {
          "type": "array",
          "minItems": 1,
          "maxItems": 20,
          "items": { "$ref": "#/$defs/automaticCriterion" }
        },
        "manualCriteria": {
          "type": "array",
          "minItems": 1,
          "maxItems": 10,
          "items": { "$ref": "#/$defs/manualCriterion" }
        }
      },
      "additionalProperties": false
    },
    "conceptRef": {
      "type": "object",
      "required": ["lessonId", "conceptIds"],
      "properties": {
        "lessonId": { "$ref": "#/$defs/stableId" },
        "conceptIds": {
          "type": "array",
          "minItems": 1,
          "maxItems": 12,
          "uniqueItems": true,
          "items": { "$ref": "#/$defs/conceptId" }
        }
      },
      "additionalProperties": false
    },
    "projectFile": {
      "type": "object",
      "required": ["path", "languageId", "starterSource"],
      "properties": {
        "path": { "$ref": "#/$defs/safePath" },
        "languageId": { "enum": ["html", "css"] },
        "starterSource": { "type": "string", "minLength": 1, "maxLength": 20480 }
      },
      "additionalProperties": false
    },
    "automaticCriterion": {
      "type": "object",
      "required": [
        "id",
        "order",
        "title",
        "description",
        "failureMessage",
        "maxPoints",
        "filePath",
        "evaluationKind",
        "assertion"
      ],
      "properties": {
        "id": { "$ref": "#/$defs/stableId" },
        "order": { "type": "integer", "minimum": 1 },
        "title": { "type": "string", "minLength": 1, "maxLength": 100 },
        "description": { "type": "string", "minLength": 1, "maxLength": 300 },
        "failureMessage": { "type": "string", "minLength": 1, "maxLength": 300 },
        "maxPoints": { "type": "integer", "minimum": 1, "maximum": 70 },
        "filePath": { "$ref": "#/$defs/safePath" },
        "evaluationKind": { "enum": ["html-dom-v1", "css-style-v1"] },
        "assertion": { "$ref": "#/$defs/assertion" }
      },
      "additionalProperties": false
    },
    "manualCriterion": {
      "type": "object",
      "required": ["id", "order", "title", "description", "maxPoints", "scale"],
      "properties": {
        "id": { "$ref": "#/$defs/stableId" },
        "order": { "type": "integer", "minimum": 1 },
        "title": { "type": "string", "minLength": 1, "maxLength": 100 },
        "description": { "type": "string", "minLength": 1, "maxLength": 500 },
        "maxPoints": { "type": "integer", "minimum": 2, "maximum": 30 },
        "scale": {
          "type": "array",
          "minItems": 3,
          "maxItems": 3,
          "items": { "$ref": "#/$defs/scaleLevel" }
        }
      },
      "additionalProperties": false
    },
    "scaleLevel": {
      "type": "object",
      "required": ["id", "label", "description", "points"],
      "properties": {
        "id": { "$ref": "#/$defs/stableId" },
        "label": { "type": "string", "minLength": 1, "maxLength": 80 },
        "description": { "type": "string", "minLength": 1, "maxLength": 300 },
        "points": { "type": "integer", "minimum": 0, "maximum": 30 }
      },
      "additionalProperties": false
    },
    "assertion": {
      "oneOf": [
        { "$ref": "#/$defs/doctypePresentAssertion" },
        { "$ref": "#/$defs/selectorExistsAssertion" },
        { "$ref": "#/$defs/selectorCountAssertion" },
        { "$ref": "#/$defs/attributeEqualsAssertion" },
        { "$ref": "#/$defs/textIncludesAssertion" },
        { "$ref": "#/$defs/nonblankAttributeCountAssertion" },
        { "$ref": "#/$defs/directChildTextEqualsAssertion" },
        { "$ref": "#/$defs/ruleDeclarationAssertion" },
        { "$ref": "#/$defs/mediaRuleDeclarationAssertion" },
        { "$ref": "#/$defs/computedStyleAssertion" },
        { "$ref": "#/$defs/computedFocusStyleAssertion" },
        { "$ref": "#/$defs/computedGridColumnCountAssertion" }
      ]
    },
    "doctypePresentAssertion": {
      "type": "object",
      "required": ["kind"],
      "properties": { "kind": { "const": "doctype-present" } },
      "additionalProperties": false
    },
    "selectorExistsAssertion": {
      "type": "object",
      "required": ["kind", "selector"],
      "properties": {
        "kind": { "const": "selector-exists" },
        "selector": { "type": "string", "minLength": 1, "maxLength": 200 }
      },
      "additionalProperties": false
    },
    "selectorCountAssertion": {
      "type": "object",
      "required": ["kind", "selector", "expected"],
      "properties": {
        "kind": { "const": "selector-count" },
        "selector": { "type": "string", "minLength": 1, "maxLength": 200 },
        "expected": { "type": "integer", "minimum": 0 }
      },
      "additionalProperties": false
    },
    "attributeEqualsAssertion": {
      "type": "object",
      "required": ["kind", "selector", "attribute", "expected"],
      "properties": {
        "kind": { "const": "attribute-equals" },
        "selector": { "type": "string", "minLength": 1, "maxLength": 200 },
        "attribute": {
          "type": "string",
          "pattern": "^[A-Za-z_:][A-Za-z0-9_.:-]*$"
        },
        "expected": { "type": "string" }
      },
      "additionalProperties": false
    },
    "textIncludesAssertion": {
      "type": "object",
      "required": ["kind", "selector", "expected"],
      "properties": {
        "kind": { "const": "text-includes" },
        "selector": { "type": "string", "minLength": 1, "maxLength": 200 },
        "expected": { "type": "string", "minLength": 1 }
      },
      "additionalProperties": false
    },
    "nonblankAttributeCountAssertion": {
      "type": "object",
      "required": ["kind", "selector", "attribute", "expected"],
      "properties": {
        "kind": { "const": "nonblank-attribute-count" },
        "selector": { "type": "string", "minLength": 1, "maxLength": 200 },
        "attribute": {
          "type": "string",
          "pattern": "^[A-Za-z_:][A-Za-z0-9_.:-]*$"
        },
        "expected": { "type": "integer", "minimum": 0 }
      },
      "additionalProperties": false
    },
    "directChildTextEqualsAssertion": {
      "type": "object",
      "required": [
        "kind",
        "selector",
        "childSelector",
        "childIndex",
        "textSelector",
        "expected"
      ],
      "properties": {
        "kind": { "const": "direct-child-text-equals" },
        "selector": { "type": "string", "minLength": 1, "maxLength": 200 },
        "childSelector": { "type": "string", "minLength": 1, "maxLength": 200 },
        "childIndex": { "type": "integer", "minimum": 0, "maximum": 99 },
        "textSelector": { "type": "string", "minLength": 1, "maxLength": 200 },
        "expected": { "type": "string", "minLength": 1 }
      },
      "additionalProperties": false
    },
    "ruleDeclarationAssertion": {
      "type": "object",
      "required": ["kind", "selector", "property", "expected"],
      "properties": {
        "kind": { "const": "rule-declaration" },
        "selector": { "type": "string", "minLength": 1, "maxLength": 200 },
        "property": {
          "type": "string",
          "pattern": "^(?:--[A-Za-z0-9_-]+|-?[A-Za-z][A-Za-z0-9-]*)$"
        },
        "expected": { "type": "string", "minLength": 1 }
      },
      "additionalProperties": false
    },
    "mediaRuleDeclarationAssertion": {
      "type": "object",
      "required": ["kind", "condition", "selector", "property", "expected"],
      "properties": {
        "kind": { "const": "media-rule-declaration" },
        "condition": { "type": "string", "minLength": 1, "maxLength": 200 },
        "selector": { "type": "string", "minLength": 1, "maxLength": 200 },
        "property": {
          "type": "string",
          "pattern": "^(?:--[A-Za-z0-9_-]+|-?[A-Za-z][A-Za-z0-9-]*)$"
        },
        "expected": { "type": "string", "minLength": 1 }
      },
      "additionalProperties": false
    },
    "computedStyleAssertion": {
      "type": "object",
      "required": ["kind", "selector", "property", "expected"],
      "properties": {
        "kind": { "const": "computed-style" },
        "selector": { "type": "string", "minLength": 1, "maxLength": 200 },
        "property": {
          "type": "string",
          "pattern": "^(?:--[A-Za-z0-9_-]+|-?[A-Za-z][A-Za-z0-9-]*)$"
        },
        "expected": { "type": "string", "minLength": 1 }
      },
      "additionalProperties": false
    },
    "computedFocusStyleAssertion": {
      "type": "object",
      "required": ["kind", "selector", "property", "expected"],
      "properties": {
        "kind": { "const": "computed-focus-style" },
        "selector": { "type": "string", "minLength": 1, "maxLength": 200 },
        "property": {
          "type": "string",
          "pattern": "^(?:--[A-Za-z0-9_-]+|-?[A-Za-z][A-Za-z0-9-]*)$"
        },
        "expected": { "type": "string", "minLength": 1 }
      },
      "additionalProperties": false
    },
    "computedGridColumnCountAssertion": {
      "type": "object",
      "required": ["kind", "selector", "viewportWidth", "expected"],
      "properties": {
        "kind": { "const": "computed-grid-column-count" },
        "selector": { "type": "string", "minLength": 1, "maxLength": 200 },
        "viewportWidth": { "type": "integer", "minimum": 320, "maximum": 1920 },
        "expected": { "type": "integer", "minimum": 1, "maximum": 12 }
      },
      "additionalProperties": false
    }
  }
}
