{
  "schemaVersion": 1,
  "contractVersion": 1,
  "title": "BAM.dev Web Project",
  "projects": [
    {
      "id": "web-project-responsive-learning-plan",
      "slug": "responsive-learning-plan",
      "revision": 2,
      "order": 1,
      "title": "반응형 학습 계획 보드",
      "summary": "HTML로 학습 계획의 의미를 구조화하고 CSS Grid와 미디어 쿼리로 화면 너비에 대응하는 보드를 완성합니다.",
      "difficulty": "beginner",
      "estimatedMinutes": 90,
      "instructions": "index.html과 styles.css를 함께 수정하세요. BAM.dev 미리보기와 평가기는 두 파일을 브라우저 안에서 직접 결합하므로 index.html에 link 요소를 작성하지 않습니다. 학습 보드의 직접 자식 카드는 HTML, CSS, JavaScript 순서로 작성합니다. 공개 자동 검사는 문서 구조와 선언을 확인하고, 수동 항목은 완성된 화면을 직접 관찰해 자가 점검합니다. 학습자 JavaScript는 이 프로젝트 범위에 포함되지 않습니다.",
      "requirements": [
        "HTML5 doctype을 사용하고 main#plan 안에 ‘학습 계획’을 포함한 h1과 .learning-board를 배치합니다.",
        "학습 메뉴 nav에 aria-label=\"학습 메뉴\"를 제공합니다.",
        "학습 보드의 직접 자식으로 HTML, CSS, JavaScript 순서의 학습 카드 세 개를 작성하고, 각 카드의 직접 h2에 해당 언어 이름을 쓰며 이름 있는 progress와 .learning-card-link를 둡니다.",
        ".learning-board의 최종 배치는 Grid이고 카드 사이 계산 간격은 16px입니다.",
        "767px 화면에서는 카드가 한 열, 768px 이상에서는 두 열로 배치됩니다.",
        "키보드 초점이 보이도록 .learning-card-link:focus-visible에 3px solid #2563eb outline을 선언합니다."
      ],
      "conceptRefs": [
        {
          "lessonId": "html-01-document-structure",
          "conceptIds": [
            "html.document-structure",
            "html.semantics",
            "html.heading-structure"
          ]
        },
        {
          "lessonId": "html-05-review-practice",
          "conceptIds": [
            "html.document-planning",
            "html.accessibility-audit"
          ]
        },
        {
          "lessonId": "css-position-flex-grid",
          "conceptIds": ["css.grid"]
        },
        {
          "lessonId": "css-responsive-states-motion",
          "conceptIds": [
            "css.responsive-design",
            "css.media-queries",
            "css.pseudo-classes"
          ]
        }
      ],
      "files": [
        {
          "path": "index.html",
          "languageId": "html",
          "starterSource": "<!doctype html>\n<header class=\"site-header\">\n  <p class=\"site-title\">나의 개발 학습</p>\n  <nav>\n    <a href=\"#plan\">이번 주 계획</a>\n  </nav>\n</header>\n\n<main id=\"plan\">\n  <h1>학습 기록</h1>\n  <section class=\"learning-board\">\n    <article class=\"learning-card\" id=\"html-plan\">\n      <h2>HTML</h2>\n      <p>의미 있는 구조를 복습합니다.</p>\n      <progress value=\"2\" max=\"5\"></progress>\n      <a class=\"learning-card-link\" href=\"#html-plan\">HTML 계획 보기</a>\n    </article>\n  </section>\n</main>"
        },
        {
          "path": "styles.css",
          "languageId": "css",
          "starterSource": ":root {\n  color-scheme: light;\n}\n\nbody {\n  margin: 0;\n  font-family: system-ui, sans-serif;\n}\n\n.learning-board {\n  display: block;\n}\n\n.learning-card {\n  padding: 16px;\n  border: 1px solid #cbd5e1;\n  border-radius: 12px;\n}"
        }
      ],
      "automaticCriteria": [
        {
          "id": "auto-html-doctype",
          "order": 1,
          "title": "HTML5 문서 선언",
          "description": "index.html이 HTML5 doctype으로 시작하는지 확인합니다.",
          "failureMessage": "문서 맨 앞에 정확한 HTML5 doctype을 작성했는지 확인하세요.",
          "maxPoints": 3,
          "filePath": "index.html",
          "evaluationKind": "html-dom-v1",
          "assertion": { "kind": "doctype-present" }
        },
        {
          "id": "auto-html-labelled-nav",
          "order": 2,
          "title": "메뉴의 접근 가능한 이름",
          "description": "첫 nav가 학습 메뉴라는 이름을 전달하는지 확인합니다.",
          "failureMessage": "nav에 aria-label=\"학습 메뉴\"를 제공해 메뉴의 목적을 설명하세요.",
          "maxPoints": 3,
          "filePath": "index.html",
          "evaluationKind": "html-dom-v1",
          "assertion": {
            "kind": "attribute-equals",
            "selector": "nav",
            "attribute": "aria-label",
            "expected": "학습 메뉴"
          }
        },
        {
          "id": "auto-html-main",
          "order": 3,
          "title": "주요 콘텐츠 영역",
          "description": "main#plan 안에 학습 보드가 있는지 확인합니다.",
          "failureMessage": "main#plan과 그 안의 .learning-board 관계를 확인하세요.",
          "maxPoints": 3,
          "filePath": "index.html",
          "evaluationKind": "html-dom-v1",
          "assertion": {
            "kind": "selector-exists",
            "selector": "main#plan .learning-board"
          }
        },
        {
          "id": "auto-html-heading",
          "order": 4,
          "title": "학습 계획 제목",
          "description": "문서의 h1이 학습 계획이라는 목적을 드러내는지 확인합니다.",
          "failureMessage": "h1에 ‘학습 계획’이라는 문구를 포함해 페이지 목적을 명확히 하세요.",
          "maxPoints": 3,
          "filePath": "index.html",
          "evaluationKind": "html-dom-v1",
          "assertion": {
            "kind": "text-includes",
            "selector": "main#plan h1",
            "expected": "학습 계획"
          }
        },
        {
          "id": "auto-html-three-cards",
          "order": 5,
          "title": "세 개의 학습 카드",
          "description": "main의 학습 보드에 직접 속한 카드가 세 개인지 확인합니다.",
          "failureMessage": "main#plan의 .learning-board 바로 아래 .learning-card 개수를 확인하세요.",
          "maxPoints": 4,
          "filePath": "index.html",
          "evaluationKind": "html-dom-v1",
          "assertion": {
            "kind": "selector-count",
            "selector": "main#plan .learning-board > article.learning-card",
            "expected": 3
          }
        },
        {
          "id": "auto-html-progress-label",
          "order": 6,
          "title": "진도 표시 이름",
          "description": "세 카드의 progress가 각각 접근 가능한 이름을 갖는지 확인합니다.",
          "failureMessage": "각 .learning-card의 progress에 내용을 설명하는 aria-label을 제공하세요.",
          "maxPoints": 4,
          "filePath": "index.html",
          "evaluationKind": "html-dom-v1",
          "assertion": {
            "kind": "nonblank-attribute-count",
            "selector": "main#plan .learning-board > article.learning-card > progress",
            "attribute": "aria-label",
            "expected": 3
          }
        },
        {
          "id": "auto-html-learning-links",
          "order": 7,
          "title": "카드별 학습 링크",
          "description": "세 카드에 키보드로 이동할 수 있는 학습 링크가 있는지 확인합니다.",
          "failureMessage": "각 .learning-card 안에 .learning-card-link를 하나씩 배치하세요.",
          "maxPoints": 4,
          "filePath": "index.html",
          "evaluationKind": "html-dom-v1",
          "assertion": {
            "kind": "selector-count",
            "selector": "main#plan .learning-board > article.learning-card:has(a.learning-card-link[href])",
            "expected": 3
          }
        },
        {
          "id": "auto-html-card-headings",
          "order": 8,
          "title": "카드 제목 구조",
          "description": "세 카드가 각각 직접 h2 제목을 갖는지 확인합니다.",
          "failureMessage": "각 article.learning-card 안에 카드 이름을 나타내는 h2를 하나씩 배치하세요.",
          "maxPoints": 2,
          "filePath": "index.html",
          "evaluationKind": "html-dom-v1",
          "assertion": {
            "kind": "selector-count",
            "selector": "main#plan .learning-board > article.learning-card > h2",
            "expected": 3
          }
        },
        {
          "id": "auto-html-card-html-name",
          "order": 9,
          "title": "HTML 카드 이름",
          "description": "첫 번째 직접 카드의 h2가 HTML인지 확인합니다.",
          "failureMessage": "첫 번째 article.learning-card의 직접 h2 제목을 HTML로 작성하세요.",
          "maxPoints": 3,
          "filePath": "index.html",
          "evaluationKind": "html-dom-v1",
          "assertion": {
            "kind": "direct-child-text-equals",
            "selector": "main#plan .learning-board",
            "childSelector": "article.learning-card",
            "childIndex": 0,
            "textSelector": "h2",
            "expected": "HTML"
          }
        },
        {
          "id": "auto-html-card-css-name",
          "order": 10,
          "title": "CSS 카드 이름",
          "description": "두 번째 직접 카드의 h2가 CSS인지 확인합니다.",
          "failureMessage": "두 번째 article.learning-card의 직접 h2 제목을 CSS로 작성하세요.",
          "maxPoints": 3,
          "filePath": "index.html",
          "evaluationKind": "html-dom-v1",
          "assertion": {
            "kind": "direct-child-text-equals",
            "selector": "main#plan .learning-board",
            "childSelector": "article.learning-card",
            "childIndex": 1,
            "textSelector": "h2",
            "expected": "CSS"
          }
        },
        {
          "id": "auto-html-card-javascript-name",
          "order": 11,
          "title": "JavaScript 카드 이름",
          "description": "세 번째 직접 카드의 h2가 JavaScript인지 확인합니다.",
          "failureMessage": "세 번째 article.learning-card의 직접 h2 제목을 JavaScript로 작성하세요.",
          "maxPoints": 3,
          "filePath": "index.html",
          "evaluationKind": "html-dom-v1",
          "assertion": {
            "kind": "direct-child-text-equals",
            "selector": "main#plan .learning-board",
            "childSelector": "article.learning-card",
            "childIndex": 2,
            "textSelector": "h2",
            "expected": "JavaScript"
          }
        },
        {
          "id": "auto-css-grid",
          "order": 12,
          "title": "Grid 레이아웃",
          "description": "학습 보드를 CSS Grid 컨테이너로 만드는지 확인합니다.",
          "failureMessage": "미리보기의 .learning-board 최종 display 값을 확인하세요.",
          "maxPoints": 10,
          "filePath": "styles.css",
          "evaluationKind": "css-style-v1",
          "assertion": {
            "kind": "computed-style",
            "selector": ".learning-board",
            "property": "display",
            "expected": "grid"
          }
        },
        {
          "id": "auto-css-gap",
          "order": 13,
          "title": "카드 간격",
          "description": "학습 카드 사이에 일관된 16px 간격이 있는지 확인합니다.",
          "failureMessage": ".learning-board의 최종 계산 gap이 요구한 16px인지 확인하세요.",
          "maxPoints": 5,